{
  "partyType": "ad id",
  "uncategorizedPartyLabel": "anim sit nulla nostrud",
  "id": "commodo in aliqua",
  "originalSourceSystem": "magna",
  "globalParty": "ipsum",
  "creationReason": "labore proident id sit",
  "originalSourceRecord": "culpa Duis consectetur incididunt",
  "primaryAccount": [
    "fugiat",
    "ut incididunt non",
    "nisi",
    "ea consequat magna",
    "anim ut sint ipsum",
    "aliqua labore quis",
    "ullamco sunt quis",
    "enim in",
    "proident minim eiusmod veniam sunt"
  ],
  "noMergeReason": "laborum cillum dolor"
}
